{
  "configVersion": 1,
  "server": {
    "apiPort": 3000,
    "webPort": 8082,
    "host": "0.0.0.0"
  },
  "database": {
    "embedded": true,
    "host": "127.0.0.1",
    "port": 5434,
    "user": "drewrest",
    "database": "DrewRest"
  },
  "backups": {
    "keepCount": 5,
    "dir": "data/backups"
  },
  "updates": {
    "channel": "stable",
    "autoCheck": false
  },
  "extensions": {}
}